{
  "schema_version": "long-lived-agent-result.v1",
  "split": "dev",
  "provider_mode": "contract_test",
  "placement_policy": "keep_hot",
  "workers": 16,
  "queue_capacity_per_worker": 8,
  "correctness": {
    "events": 96,
    "useful_events": 96,
    "protocol_valid_events": 96,
    "cross_talk": 0,
    "failed_events": 0
  },
  "lifecycle": {
    "states_created": 32,
    "states_released": 32,
    "state_leak_count": 0,
    "snapshots": 0,
    "restores": 0,
    "checksum_failures": 0
  },
  "metrics": {
    "wall_ms": 0.767217,
    "events_per_second": 125127.5714693496,
    "useful_events_per_second": 125127.5714693496,
    "event_completion_latency": {
      "p50_ms": 0.062,
      "p95_ms": 0.166,
      "p99_ms": 0.177,
      "max_ms": 0.177
    },
    "wake_latency": {
      "available": false,
      "reason": "provider v1 has no explicit inference-ready signal"
    },
    "ttft": {
      "available": false,
      "reason": "provider v1 continuation is non-streaming"
    },
    "queue_backpressure_count": 4,
    "reprefill_bytes": 0,
    "restore_bytes": 0
  },
  "errors": []
}